ID,Title,Rating,Year,Month,Certificate,Runtime,Directors,Stars,Genre,Filming_location,Budget,Income,Country_of_origin1345,Angels & Demons,6.7,2009,May,PG-13,138,Ron Howard,"Tom Hanks, Ewan McGregor, Ayelet Zurer, Stellan Skarsg rd","Action, Mystery, Thriller",Vatican City,150000000,485930816,"United States, Italy"1346,The Princess and the Frog,7.1,2009,December,G,97,"Ron Clements, John Musker","Anika Noni Rose, Keith David, Oprah Winfrey, Bruno Campos","Animation, Adventure, Comedy",USA,105000000,267045765,United States1347,The Twilight Saga: New Moon,4.7,2009,November,PG-13,130,Chris Weitz,"Kristen Stewart, Robert Pattinson, Taylor Lautner, Christina Jastrzembska","Adventure, Drama, Fantasy",Italy,50000000,711025481,United States1348,Triangle,6.9,2009,October,R,99,Christopher Smith,"Melissa George, Joshua McIvor, Jack Taylor, Michael Dorman","Fantasy, Mystery, Sci-Fi",Australia,12000000,1333377,"United Kingdom, Australia"1349,Cloudy with a Chance of Meatballs,6.9,2009,September,PG,90,"Phil Lord, Christopher Miller","Anna Faris, Bill Hader, Bruce Campbell, James Caan","Animation, Adventure, Comedy",USA,100000000,243006126,United States1350,G.I. Joe: The Rise of Cobra,5.7,2009,August,PG-13,118,Stephen Sommers,"Dennis Quaid, Channing Tatum, Marlon Wayans, Adewale Akinnuoye Agbaje","Action, Adventure, Sci-Fi",Czech Republic,175000000,302469017,United States1351,"I Love You, Man",7,2009,March,R,105,John Hamburg,"Paul Rudd, Jason Segel, Rashida Jones, Sarah Burns","Comedy, Romance",USA,40000000,91980359,United States1352,My Sister's Keeper,7.3,2009,June,PG-13,109,Nick Cassavetes,"Cameron Diaz, Abigail Breslin, Alec Baldwin, Walter Raney","Drama, Family",USA,30000000,95714875,United States1353,Monsters vs. Aliens,6.4,2009,March,PG,94,"Rob Letterman, Conrad Vernon","Reese Witherspoon, Rainn Wilson, Stephen Colbert, Seth Rogen","Animation, Action, Adventure",Unknown,175000000,381509870,United States1354,The Girl with the Dragon Tattoo,7.8,2009,April,R,152,Niels Arden Oplev,"Michael Nyqvist, Noomi Rapace, Ewa Fr ling, Lena Endre","Crime, Drama, Mystery",Spain,13000000,104414200,"Sweden, Denmark, Germany, Norway"1355,Pandorum,6.7,2009,September,R,108,Christian Alvart,"Dennis Quaid, Ben Foster, Cam Gigandet, Antje Traue","Action, Horror, Mystery",Germany,33000000,20648328,"Germany, United Kingdom"1356,State of Play,7.1,2009,April,PG-13,127,Kevin Macdonald,"Russell Crowe, Rachel McAdams, Ben Affleck, Helen Mirren","Crime, Drama, Mystery",USA,60000000,87812371,"United States, United Kingdom, France"1357,Drag Me to Hell,6.6,2009,May,PG-13,99,Sam Raimi,"Alison Lohman, Justin Long, Ruth Livier, Lorna Raver",Horror,USA,30000000,90842646,United States1358,Land of the Lost,5.3,2009,June,PG-13,102,Brad Silberling,"Will Ferrell, Danny McBride, Anna Friel, Jorma Taccone","Action, Adventure, Comedy",USA,100000000,68777554,United States1359,Push,6.1,2009,February,PG-13,111,Paul McGuigan,"Camilla Belle, Dakota Fanning, Chris Evans, Colin Ford","Action, Sci-Fi, Thriller",China,38000000,48858618,"United States, Canada"1360,Chloe,6.3,2009,March,R,96,Atom Egoyan,"Julianne Moore, Amanda Seyfried, Liam Neeson, Max Thieriot",Thriller,Canada,14000000,13657649,"Canada, France, United States"1361,9,7,2009,September,PG-13,79,Shane Acker,"Elijah Wood, Jennifer Connelly, Crispin Glover, Christopher Plummer","Animation, Action, Adventure",Luxembourg,30000000,48428063,"United States, Canada, Luxembourg"1362,After.Life,5.9,2009,December,R,104,Agnieszka Wojtowicz Vosloo,"Christina Ricci, Liam Neeson, Justin Long, Chandler Canterbury","Drama, Mystery, Thriller",USA,4500000,2425535,United States1363,Precious,7.3,2009,November,R,110,Lee Daniels,"Gabourey Sidibe, Mo Nique, Paula Patton, Mariah Carey",Drama,USA,10000000,63649529,United States1364,Friday the 13th,5.5,2009,February,R,97,Marcus Nispel,"Jared Padalecki, Amanda Righetti, Derek Mears, Danielle Panabaker","Horror, Mystery, Thriller",USA,19000000,91509154,United States1365,Blood and Bone,6.7,2009,September,R,93,Ben Ramsey,"Michael Jai White, Julian Sands, Eamonn Walker, Dante Basco","Action, Crime, Drama",USA,3700000,3492,United States1366,Nowhere Boy,7.1,2009,December,R,98,Sam Taylor Johnson,"Aaron Taylor Johnson, Kristin Scott Thomas, Anne Marie Duff, David Threlfall","Biography, Drama, Music",UK,Unknown,"$6,577,779","United Kingdom, Canada"1367,Knowing,6.2,2009,March,PG-13,121,Alex Proyas,"Nicolas Cage, Chandler Canterbury, Rose Byrne, Lara Robinson","Action, Mystery, Sci-Fi",Australia,50000000,183658498,"United States, United Kingdom, Australia"1368,Dragonball Evolution,2.6,2009,April,PG,85,James Wong,"Justin Chatwin, James Marsters, Chow Yun Fat, Emmy Rossum","Action, Adventure, Fantasy",Mexico,30000000,55720772,"United Kingdom, Mexico, Hong Kong, United States"1369,It's Complicated,6.5,2009,December,R,120,Nancy Meyers,"Meryl Streep, Steve Martin, Alec Baldwin, John Krasinski","Comedy, Drama, Romance",USA,85000000,219103655,"Japan, United States"1370,The Ugly Truth,6.4,2009,July,R,96,Robert Luketic,"Katherine Heigl, Gerard Butler, Bree Turner, Eric Winter","Comedy, Romance",USA,38000000,205599393,United States1371,Exam,6.8,2009,June,Not Rated,101,Stuart Hazeldine,"Adar Beck, Gemma Chan, Nathalie Cox, John Lloyd Fillingham","Crime, Horror, Mystery",UK,Unknown,"$394,717",United Kingdom1372,Surrogates,6.3,2009,September,PG-13,89,Jonathan Mostow,"Bruce Willis, Radha Mitchell, Ving Rhames, Rosamund Pike","Action, Sci-Fi, Thriller",USA,80000000,122444772,United States1373,The Final Destination,5.1,2009,August,R,82,David R Ellis,"Nick Zano, Krista Allen, Andrew Fiscella, Bobby Campo","Horror, Thriller",USA,40000000,186167139,United States1374,Nine,5.8,2009,December,PG-13,118,Rob Marshall,"Daniel Day Lewis, Marion Cotillard, Pen lope Cruz, Sandro Dori","Drama, Musical, Romance",Italy,80000000,54004950,"United Kingdom, United States"1375,A Serious Man,7,2009,November,R,106,"Ethan Coen, Joel Coen","Michael Stuhlbarg, Richard Kind, Sari Lennick, Fred Melamed",Drama,Czech Republic,7000000,31430334,"United Kingdom, France, United States"1376,The Imaginarium of Doctor Parnassus,6.8,2009,January,PG-13,123,Terry Gilliam,"Christopher Plummer, Lily Cole, Heath Ledger, Andrew Garfield","Adventure, Comedy, Fantasy",Canada,30000000,61808775,"United Kingdom, France, Canada"1377,Ghosts of Girlfriends Past,5.8,2009,May,PG-13,100,Mark Waters,"Matthew McConaughey, Jennifer Garner, Emma Stone, Michael Douglas","Comedy, Fantasy, Romance",USA,37500000,102366815,United States1378,Case 39,6.2,2009,October,R,109,Christian Alvart,"Ren e Zellweger, Ian McShane, Jodelle Ferland, Bradley Cooper","Horror, Mystery, Thriller",USA,26000000,28190603,"United States, Canada"1379,Crazy Heart,7.2,2009,February,R,112,Scott Cooper,"Jeff Bridges, Maggie Gyllenhaal, Colin Farrell, James Keane","Drama, Music, Romance",USA,7000000,47405566,United States1380,Alvin and the Chipmunks: The Squeakquel,4.5,2009,December,PG,88,Betty Thomas,"Jason Lee, Zachary Levi, David Cross, Justin Long","Animation, Adventure, Comedy",France,75000000,443140005,United States1381,Recep Ivedik 2,4.4,2009,February,Not Rated,107,Togan G kbakar,"Sahan G kbakar, G lsen zbakan, Efe Babacan, agri B y ksayar",Comedy,Turkey,Unknown,"$27,699,692",Turkey1382,Funny People,6.3,2009,July,R,146,Judd Apatow,"Adam Sandler, Seth Rogen, Leslie Mann, Eric Bana","Comedy, Drama",USA,75000000,71585235,United States1383,Julie & Julia,7,2009,August,PG-13,123,Nora Ephron,"Amy Adams, Meryl Streep, Chris Messina, Stanley Tucci","Biography, Drama, Romance",USA,40000000,129540522,United States1384,Everybody's Fine,7.1,2009,December,PG-13,99,Kirk Jones,"Robert De Niro, Kate Beckinsale, Sam Rockwell, Drew Barrymore","Adventure, Drama",USA,21000000,16443609,United States1385,The Scouting Book for Boys,6.6,2009,March,Not Rated,93,Tom Harper,"Thomas Turgoose, Holliday Grainger, Ruth Wellman, Ewen MacIntosh","Drama, Thriller",UK,1230145,Unknown,United Kingdom1386,Year One,4.9,2009,June,PG-13,97,Harold Ramis,"Jack Black, Michael Cera, Olivia Wilde, Oliver Platt",Comedy,USA,60000000,62357900,United States1387,The Boat That Rocked,7.3,2009,November,R,117,Richard Curtis,"Philip Seymour Hoffman, Bill Nighy, Nick Frost, Michael Hadley","Comedy, Drama, Music",UK,50000000,36348784,"United Kingdom, France, Germany, United States"1388,Thirst,7.1,2009,April,R,134,Park Chan wook,"Song Kang ho, Kim Ok bin, Hee jin Choi, Seo Dong soo","Drama, Fantasy, Horror",South Korea,5000000,13085023,"South Korea, United States"1389,Mary and Max,8.1,2009,March,Not Rated,92,Adam Elliot,"Toni Collette, Philip Seymour Hoffman, Eric Bana, Barry Humphries","Animation, Comedy, Drama",Australia,6069996,1740429,Australia1390,The Box,5.6,2009,November,PG-13,115,Richard Kelly,"Cameron Diaz, James Marsden, Frank Langella, James Rebhorn","Drama, Mystery, Thriller",USA,30000000,33334176,United States1391,Fired Up!,6.1,2009,February,PG-13,90,Will Gluck,"Eric Christian Olsen, Nicholas D Agosto, Sarah Roemer, Molly Sims","Comedy, Sport",USA,20000000,18599102,United States1392,The Time Traveler's Wife,7.1,2009,August,PG-13,107,Robert Schwentke,"Eric Bana, Rachel McAdams, Ron Livingston, Michelle Nolden","Comedy, Drama, Fantasy",Canada,39000000,101344412,United States1393,A Perfect Getaway,6.5,2009,August,R,98,David Twohy,"Milla Jovovich, Steve Zahn, Timothy Olyphant, Kiele Sanchez","Drama, Mystery, Thriller",USA,14000000,22955544,United States1394,The Uninvited,6.3,2009,January,PG-13,87,"Charles Guard, Thomas Guard","Emily Browning, Arielle Kebbel, Elizabeth Banks, David Strathairn","Drama, Fantasy, Horror",Canada,Unknown,"$41,633,384","United States, Canada, Germany"1395,Mother,7.8,2009,May,R,129,Bong Joon Ho,"Hye ja Kim, Won Bin, Jin Goo, Je mun Yun","Crime, Drama, Mystery",South Korea,5000000,17267324,South Korea1396,Where the Wild Things Are,6.7,2009,October,PG,101,Spike Jonze,"Max Records, Catherine O Hara, Forest Whitaker, Pepita Emmerichs","Adventure, Drama, Family",Australia,100000000,100140916,"Germany, United States, Australia"1397,Invictus,7.3,2009,December,PG-13,134,Clint Eastwood,"Morgan Freeman, Matt Damon, Tony Kgoroge, Patrick Mofokeng","Action, Biography, Drama",South Africa,60000000,122426792,United States1398,Paul Blart: Mall Cop,5.2,2009,January,PG,91,Steve Carr,"Kevin James, Keir O Donnell, Jayma Mays, Raini Rodriguez","Action, Comedy, Crime",USA,26000000,183348429,United States1399,Four Christmases,5.7,2008,November,PG-13,88,Seth Gordon,"Reese Witherspoon, Vince Vaughn, Mary Steenburgen, Robert Duvall","Comedy, Drama, Romance",USA,80000000,164112721,"Germany, United States"1400,The Dark Knight,9,2008,July,PG-13,152,Christopher Nolan,"Christian Bale, Heath Ledger, Aaron Eckhart, Michael Caine","Action, Crime, Drama",USA,185000000,1006234167,"United States, United Kingdom"1401,In Bruges,7.9,2008,February,R,107,Martin McDonagh,"Colin Farrell, Brendan Gleeson, Ciar n Hinds, Elizabeth Berrington","Comedy, Crime, Drama",Belgium,15000000,39628044,"United Kingdom, United States"1402,Twilight,5.3,2008,November,PG-13,122,Catherine Hardwicke,"Kristen Stewart, Robert Pattinson, Billy Burke, Sarah Clarke","Drama, Fantasy, Romance",USA,37000000,408430415,United States1403,Iron Man,7.9,2008,May,PG-13,126,Jon Favreau,"Robert Downey Jr , Gwyneth Paltrow, Terrence Howard, Jeff Bridges","Action, Adventure, Sci-Fi",USA,140000000,585796247,"United States, Canada"1404,Tropic Thunder,7,2008,August,R,107,Ben Stiller,"Ben Stiller, Jack Black, Robert Downey Jr , Jeff Kahn","Action, Comedy, War",USA,92000000,195702963,"United States, United Kingdom, Germany"1405,Taken,7.8,2008,January,PG-13,90,Pierre Morel,"Liam Neeson, Maggie Grace, Famke Janssen, Leland Orser","Action, Crime, Thriller",France,25000000,226837760,"United Kingdom, France, United States"1406,Step Brothers,6.9,2008,July,R,98,Adam McKay,"Will Ferrell, John C Reilly, Mary Steenburgen, Richard Jenkins",Comedy,USA,65000000,128108211,United States1407,Burn After Reading,7,2008,September,R,96,"Ethan Coen, Joel Coen","Brad Pitt, Frances McDormand, George Clooney, John Malkovich","Comedy, Crime, Drama",USA,37000000,163728902,"United States, United Kingdom, France"1408,Indiana Jones and the Kingdom of the Crystal Skull,6.2,2008,May,PG-13,122,Steven Spielberg,"Harrison Ford, Cate Blanchett, Shia LaBeouf, Karen Allen","Action, Adventure",Argentina,185000000,790653942,United States1409,Martyrs,7,2008,September,R,99,Pascal Laugier,"Morjana Alaoui, Myl ne Jampano , Catherine B gin, Robert Toupin",Horror,Canada,3390000,1149138,"France, Canada"1410,The Curious Case of Benjamin Button,7.8,2008,December,PG-13,166,David Fincher,"Brad Pitt, Cate Blanchett, Tilda Swinton, Julia Ormond","Drama, Fantasy, Romance",India,150000000,335802786,United States1411,The Reader,7.6,2008,January,R,124,Stephen Daldry,"Kate Winslet, Ralph Fiennes, Bruno Ganz, Jeanette Hain","Drama, Romance",Germany,32000000,108902486,"Germany, United States"1412,The Boy in the Striped Pajamas,7.7,2008,November,PG-13,94,Mark Herman,"Asa Butterfield, David Thewlis, Rupert Friend, Zac Mattoon O Brien","Drama, War",Hungary,12500000,40416563,"United Kingdom, United States"1413,WALLáE,8.4,2008,June,G,98,Andrew Stanton,"Ben Burtt, Elissa Knight, Jeff Garlin, Fred Willard","Animation, Adventure, Family",USA,180000000,521311890,United States1414,Mamma Mia!,6.5,2008,July,PG-13,108,Phyllida Lloyd,"Meryl Streep, Pierce Brosnan, Amanda Seyfried, Stellan Skarsg rd","Comedy, Musical, Romance",Greece,52000000,694476782,"United States, United Kingdom, Germany"1415,The Chronicles of Narnia: Prince Caspian,6.5,2008,May,PG,150,Andrew Adamson,"Ben Barnes, Skandar Keynes, Georgie Henley, William Moseley","Action, Adventure, Family",Slovenia,225000000,419665568,"United States, Poland, Slovenia, Czech Republic, United Kingdom"1416,Cloverfield,7,2008,January,PG-13,85,Matt Reeves,"Mike Vogel, Jessica Lucas, Lizzy Caplan, T J Miller","Action, Adventure, Horror",USA,25000000,172394180,United States1417,Let the Right One In,7.9,2008,December,R,114,Tomas Alfredson,"K re Hedebrant, Lina Leandersson, Per Ragnar, Henrik Dahl","Drama, Fantasy, Horror",Sweden,4000000,11227336,Sweden1418,Wanted,6.7,2008,June,R,110,Timur Bekmambetov,"Angelina Jolie, James McAvoy, Morgan Freeman, Terence Stamp","Action, Crime, Thriller",Czech Republic,75000000,342463063,"United States, Germany"1419,21,6.8,2008,March,PG-13,123,Robert Luketic,"Jim Sturgess, Kate Bosworth, Kevin Spacey, Aaron Yoo","Crime, Drama, History",USA,35000000,159808370,United States1420,The Mummy: Tomb of the Dragon Emperor,5.2,2008,August,PG-13,112,Rob Cohen,"Brendan Fraser, Jet Li, Maria Bello, Michelle Yeoh","Action, Adventure, Fantasy",UK,145000000,403449830,"United States, Germany, China, Canada"1421,Ghost Town,6.7,2008,September,PG-13,102,David Koepp,"Ricky Gervais, Greg Kinnear, T a Leoni, Jordan Carlos","Comedy, Drama, Fantasy",USA,20000000,27090159,United States1422,Revolutionary Road,7.3,2008,January,R,119,Sam Mendes,"Leonardo DiCaprio, Kate Winslet, Christopher Fitzgerald, Jonathan Roumie","Drama, Romance",USA,35000000,75981180,"United States, United Kingdom"1423,Quantum of Solace,6.6,2008,November,PG-13,106,Marc Forster,"Daniel Craig, Olga Kurylenko, Mathieu Amalric, Judi Dench","Action, Adventure, Mystery",Italy,200000000,589580482,"United Kingdom, United States"1424,Kung Fu Panda,7.6,2008,June,PG,92,"Mark Osborne, John Stevenson","Jack Black, Ian McShane, Angelina Jolie, Dustin Hoffman","Animation, Action, Adventure",USA,130000000,632083197,United States1425,The Hurt Locker,7.5,2008,July,R,131,Kathryn Bigelow,"Jeremy Renner, Anthony Mackie, Brian Geraghty, Guy Pearce","Drama, Thriller, War",Jordan,15000000,49259766,United States1426,Journey to the Center of the Earth,5.8,2008,July,PG,93,Eric Brevig,"Brendan Fraser, Josh Hutcherson, Anita Briem, Seth Meyers","Action, Adventure, Family",Iceland,60000000,244232688,United States1427,Eden Lake,6.7,2008,September,R,91,James Watkins,"Kelly Reilly, Michael Fassbender, Tara Ellis, Jack O Connell","Horror, Thriller",UK,Unknown,"$3,984,669",United Kingdom1428,The Happening,5,2008,June,R,91,M Night Shyamalan,"Mark Wahlberg, Zooey Deschanel, John Leguizamo, Ashlyn Sanchez","Adventure, Drama, Sci-Fi",USA,48000000,163403799,"India, United States"1429,The Wrestler,7.9,2008,January,R,109,Darren Aronofsky,"Mickey Rourke, Marisa Tomei, Evan Rachel Wood, Mark Margolis","Drama, Sport",USA,6000000,44734660,"United States, France"1430,Vicky Cristina Barcelona,7.1,2008,August,PG-13,96,Woody Allen,"Rebecca Hall, Scarlett Johansson, Javier Bardem, Christopher Evan Welch","Comedy, Drama, Romance",Spain,15500000,96409300,"Spain, United States"1431,Gran Torino,8.1,2008,January,R,116,Clint Eastwood,"Clint Eastwood, Bee Vang, Christopher Carley, Ahney Her",Drama,USA,33000000,269958228,"Germany, United States"1432,Never Back Down,6.5,2008,March,PG-13,113,Jeff Wadlow,"Sean Faris, Djimon Hounsou, Amber Heard, Cam Gigandet","Action, Drama, Sport",USA,20000000,41627431,United States1433,The Incredible Hulk,6.6,2008,June,PG-13,112,Louis Leterrier,"Edward Norton, Liv Tyler, Tim Roth, William Hurt","Action, Adventure, Sci-Fi",Canada,150000000,264770996,United States1434,Slumdog Millionaire,8,2008,December,R,120,"Danny Boyle, Loveleen Tandan","Dev Patel, Freida Pinto, Saurabh Shukla, Anil Kapoor","Crime, Drama, Romance",India,15000000,378410542,"United Kingdom, United States"1435,Pineapple Express,6.9,2008,August,R,111,David Gordon Green,"Seth Rogen, James Franco, Gary Cole, Danny McBride","Action, Comedy, Crime",USA,27000000,101624843,United States1436,Rambo,7,2008,January,R,92,Sylvester Stallone,"Sylvester Stallone, Julie Benz, Matthew Marsden, Graham McTavish","Action, Adventure, Thriller",Thailand,50000000,113244290,"Germany, United States"1437,Zack and Miri Make a Porno,6.5,2008,October,R,101,Kevin Smith,"Seth Rogen, Elizabeth Banks, Craig Robinson, Gerry Bednob","Comedy, Romance",USA,24000000,42784344,United States1438,Street Kings,6.8,2008,April,R,109,David Ayer,"Keanu Reeves, Forest Whitaker, Hugh Laurie, Chris Evans","Action, Crime, Thriller",USA,20000000,66476363,United States1439,Nothing Like the Holidays,6.1,2008,December,PG-13,98,Alfredo Rodriguez de Villa,"John Leguizamo, Freddy Rodr guez, Debra Messing, Alfred Molina","Comedy, Drama, Romance",USA,Unknown,"$7,519,490",United States1440,"10,000 BC",5.1,2008,March,PG-13,109,Roland Emmerich,"Camilla Belle, Steven Strait, Marco Khan, Cliff Curtis","Action, Adventure, Drama",New Zealand,105000000,269784201,"United States, South Africa"1441,The Family That Preys,5.8,2008,September,PG-13,111,Tyler Perry,"Kathy Bates, Alfre Woodard, Sanaa Lathan, Rockmond Dunbar",Drama,USA,Unknown,"$37,105,289",United States1442,"Definitely, Maybe",7.1,2008,February,PG-13,112,Adam Brooks,"Ryan Reynolds, Rachel Weisz, Abigail Breslin, An Nguyen","Comedy, Drama, Romance",USA,Unknown,"$55,990,299","United Kingdom, France, Germany, United States"1443,RocknRolla,7.2,2008,October,R,114,Guy Ritchie,"Gerard Butler, Tom Wilkinson, Idris Elba, Thandiwe Newton","Action, Crime, Thriller",UK,18000000,25740863,"United Kingdom, United States, France"1444,Forgetting Sarah Marshall,7.1,2008,April,R,111,Nicholas Stoller,"Kristen Bell, Jason Segel, Paul Rudd, Mila Kunis","Comedy, Drama, Romance",USA,30000000,105833257,United States1445,You Don't Mess with the Zohan,5.6,2008,June,PG-13,113,Dennis Dugan,"Adam Sandler, John Turturro, Emmanuelle Chriqui, Nick Swardson","Action, Comedy",Israel,90000000,204313400,United States1446,Recep Ivedik,4.8,2008,February,Not Rated,90,Togan G kbakar,"Sahan G kbakar, Fatma Toptas, Tulug izgen, Ismail Hakki r n",Comedy,Turkey,500000,28548025,Turkey1447,Sex Drive,6.5,2008,October,R,109,Sean Anders,"Josh Zuckerman, Clark Duke, Amanda Crew, James Marsden","Comedy, Romance",USA,19000000,18755936,United States1448,Valkyrie,7.1,2008,December,PG-13,121,Bryan Singer,"Tom Cruise, Bill Nighy, Carice van Houten, Kenneth Branagh","Drama, History, Thriller",Germany,75000000,201545517,"United States, Germany, Italy, Spain, France, Japan, United Kingdom"1449,The House Bunny,5.5,2008,August,PG-13,97,Fred Wolf,"Anna Faris, Colin Hanks, Emma Stone, Kat Dennings",Comedy,USA,25000000,70439696,United States1450,Yes Man,6.8,2008,December,PG-13,104,Peyton Reed,"Jim Carrey, Zooey Deschanel, Bradley Cooper, John Michael Higgins","Comedy, Romance",USA,70000000,223241637,"United States, United Kingdom"1451,Jumper,6.1,2008,February,PG-13,88,Doug Liman,"Hayden Christensen, Samuel L Jackson, Jamie Bell, Rachel Bilson","Action, Adventure, Sci-Fi",Egypt,85000000,225132113,"United States, Canada"1452,Superhero Movie,4.6,2008,March,PG-13,75,Craig Mazin,"Drake Bell, Leslie Nielsen, Sara Paxton, Christopher McDonald","Action, Comedy, Sci-Fi",USA,35000000,71571300,United States1453,Hancock,6.4,2008,July,PG-13,92,Peter Berg,"Will Smith, Charlize Theron, Jason Bateman, Jae Head","Action, Drama, Fantasy",USA,150000000,629443428,United States1454,27 Dresses,6.1,2008,January,PG-13,111,Anne Fletcher,"Katherine Heigl, James Marsden, Malin Akerman, Brian Kerwin","Comedy, Romance",USA,30000000,162655351,United States1455,The Strangers,6.1,2008,May,R,86,Bryan Bertino,"Scott Speedman, Liv Tyler, Gemma Ward, Alex Fisher","Horror, Mystery, Thriller",Official Facebook,9000000,82410456,United States1456,Bronson,7,2008,March,R,92,Nicolas Winding Refn,"Tom Hardy, Kelly Adams, Luing Andrews, Katy Barker","Action, Biography, Crime",UK,230000,2260712,"United Kingdom, Denmark"1457,Sex and the City,5.7,2008,May,R,145,Michael Patrick King,"Sarah Jessica Parker, Kim Cattrall, Cynthia Nixon, Kristin Davis","Comedy, Drama, Romance",USA,65000000,418765519,United States1458,City of Ember,6.4,2008,October,PG,90,Gil Kenan,"Saoirse Ronan, Toby Jones, Bill Murray, David Ryall","Adventure, Family, Fantasy",UK,55000000,17929684,United States1459,Seven Pounds,7.6,2008,December,PG-13,123,Gabriele Muccino,"Will Smith, Rosario Dawson, Woody Harrelson, Michael Ealy",Drama,USA,55000000,169748929,United States1460,The Day the Earth Stood Still,5.5,2008,December,PG-13,104,Scott Derrickson,"Keanu Reeves, Jennifer Connelly, Kathy Bates, Jaden Smith","Adventure, Drama, Sci-Fi",Canada,80000000,233093859,"United States, Canada"1461,Hellboy II: The Golden Army,7,2008,July,PG-13,120,Guillermo del Toro,"Ron Perlman, Selma Blair, Doug Jones, John Alexander","Action, Adventure, Fantasy",Hungary,85000000,168319243,"United States, Germany, Hungary"1462,Speed Racer,6,2008,May,PG,135,"Lana Wachowski, Lilly Wachowski","Emile Hirsch, Matthew Fox, Christina Ricci, Nicholas Elia","Action, Adventure, Comedy",Germany,120000000,93945766,"United States, Australia, Germany, Japan"1463,Madagascar: Escape 2 Africa,6.6,2008,November,PG,89,"Eric Darnell, Tom McGrath","Ben Stiller, Chris Rock, David Schwimmer, Jada Pinkett Smith","Animation, Adventure, Comedy",USA,150000000,603900354,United States1464,Doomsday,5.9,2008,March,R,105,Neil Marshall,"Rhona Mitra, Bob Hoskins, Alexander Siddig, Caryn Peterson","Action, Sci-Fi, Thriller",UK,30000000,22472631,"United Kingdom, United States, South Africa, Germany"1465,Changeling,7.8,2008,October,R,141,Clint Eastwood,"Angelina Jolie, Colm Feore, Amy Ryan, Gattlin Griffith","Biography, Crime, Drama",USA,55000000,113398237,United States1466,"Synecdoche, New York",7.5,2008,February,R,124,Charlie Kaufman,"Philip Seymour Hoffman, Samantha Morton, Michelle Williams, Catherine Keener",Drama,USA,20000000,4658401,United States1467,The Other Boleyn Girl,6.7,2008,February,PG-13,115,Justin Chadwick,"Natalie Portman, Scarlett Johansson, Eric Bana, Jim Sturgess","Biography, Drama, History",UK,35000000,78201830,"United Kingdom, United States"1468,The Ruins,5.9,2008,April,R,90,Carter Smith,"Shawn Ashmore, Jena Malone, Jonathan Tucker, Laura Ramsey",Horror,Australia,8000000,22818256,"United States, Germany, Australia"1469,Ip Man,8,2008,December,R,106,Wilson Yip,"Donnie Yen, Simon Yam, Siu Wong Fan, Ka Tung Lam","Action, Biography, Drama",Unknown,11715578,22108789,"Hong Kong, China"1470,The Bank Job,7.2,2008,March,R,111,Roger Donaldson,"Jason Statham, Saffron Burrows, Stephen Campbell Moore, Daniel Mays","Crime, Drama, Thriller",UK,20000000,64828421,"United Kingdom, United States, Australia"1471,Inkheart,6.1,2008,January,PG,106,Iain Softley,"Brendan Fraser, Andy Serkis, Eliza Bennett, Sienna Guillory","Adventure, Family, Fantasy",UK,60000000,62803180,"Germany, United Kingdom, United States, Italy"1472,Ponyo,7.6,2008,August,G,101,Hayao Miyazaki,"Cate Blanchett, Matt Damon, Liam Neeson, Tomoko Yamaguchi","Animation, Adventure, Comedy",Unknown,34000000,204826668,Japan1473,Bolt,6.8,2008,November,PG,96,"Byron Howard, Chris Williams","John Travolta, Miley Cyrus, Susie Essman, Mark Walton","Animation, Adventure, Comedy",USA,150000000,309979994,United States1474,Death Race,6.4,2008,August,R,105,Paul W S Anderson,"Jason Statham, Joan Allen, Tyrese Gibson, Ian McShane","Action, Sci-Fi, Thriller",Canada,45000000,76014335,"United States, Germany, United Kingdom"1475,Role Models,6.8,2008,November,R,99,David Wain,"Paul Rudd, Seann William Scott, Elizabeth Banks, Christopher Mintz Plasse",Comedy,USA,28000000,92649419,"Germany, United States"1476,Get Smart,6.5,2008,June,PG-13,110,Peter Segal,"Steve Carell, Anne Hathaway, Alan Arkin, Dwayne Johnson","Action, Adventure, Comedy",Canada,80000000,230685453,United States1477,The Spiderwick Chronicles,6.5,2008,February,PG,96,Mark Waters,"Freddie Highmore, Sarah Bolger, David Strathairn, Mary Louise Parker","Action, Adventure, Drama",Canada,90000000,164170327,United States1478,Body of Lies,7,2008,October,R,128,Ridley Scott,"Leonardo DiCaprio, Russell Crowe, Mark Strong, Golshifteh Farahani","Action, Drama, Thriller",Morocco,70000000,115900897,"United States, United Kingdom"