ID,Title,Rating,Year,Month,Certificate,Runtime,Directors,Stars,Genre,Filming_location,Budget,Income,Country_of_origin539,Life,6.6,2017,March,R,104,Daniel Espinosa,"Jake Gyllenhaal, Rebecca Ferguson, Ryan Reynolds, Hiroyuki Sanada","Horror, Sci-Fi, Thriller",Vietnam,58000000,100541806,United States540,Phantom Thread,7.4,2017,January,R,130,Paul Thomas Anderson,"Vicky Krieps, Daniel Day Lewis, Lesley Manville, Julie Vollono","Drama, Romance",UK,35000000,47779793,"United States, United Kingdom, China"541,A Christmas Prince,5.8,2017,November,TV-PG,92,Alex Zamm,"Rose McIver, Ben Lamb, Alice Krige, Honor Kneafsey","Comedy, Family, Romance",Romania,Unknown,Unknown,United States542,Molly's Game,7.4,2017,January,R,140,Aaron Sorkin,"Jessica Chastain, Idris Elba, Kevin Costner, Michael Cera","Biography, Crime, Drama",Canada,30000000,59284015,"United States, Canada, China"543,Alien: Covenant,6.4,2017,May,R,122,Ridley Scott,"Michael Fassbender, Katherine Waterston, Billy Crudup, Danny McBride","Horror, Sci-Fi, Thriller",New Zealand,97000000,240891763,"United Kingdom, United States"544,What Happened to Monday,6.8,2017,August,TV-MA,123,Tommy Wirkola,"Noomi Rapace, Glenn Close, Willem Dafoe, Marwan Kenzari","Action, Crime, Fantasy",Romania,Unknown,"$27,975,429","United Kingdom, France, United States, Belgium"545,2:22,5.7,2017,June,PG-13,98,Paul Currie,"Michiel Huisman, Teresa Palmer, Sam Reid, John Waters","Drama, Mystery, Romance",Australia,Unknown,"$3,945,729","Australia, United States"546,King Arthur: Legend of the Sword,6.7,2017,May,PG-13,126,Guy Ritchie,"Charlie Hunnam, Astrid Berg s Frisbey, Jude Law, Djimon Hounsou","Action, Adventure, Drama",UK,175000000,148675066,"United Kingdom, United States, Australia"547,Power Rangers,5.9,2017,March,PG-13,124,Dean Israelite,"Dacre Montgomery, Naomi Scott, RJ Cyler, Ludi Lin","Action, Adventure, Fantasy",Canada,100000000,142337240,"United States, Hong Kong, Japan, Canada, New Zealand"548,Wonder,7.9,2017,November,PG,113,Stephen Chbosky,"Jacob Tremblay, Owen Wilson, Izabela Vidovic, Julia Roberts","Drama, Family",Canada,20000000,315025930,"United States, Hong Kong, Canada"549,Atomic Blonde,6.7,2017,July,R,115,David Leitch,"Charlize Theron, James McAvoy, John Goodman, Eddie Marsan","Action, Thriller",Hungary,30000000,100014025,"United States, Germany, Sweden, Hungary"550,The Mummy,5.4,2017,June,PG-13,110,Alex Kurtzman,"Tom Cruise, Sofia Boutella, Annabelle Wallis, Russell Crowe","Action, Adventure, Fantasy",UK,125000000,409231607,"United States, China, Japan"551,Logan Lucky,7,2017,August,PG-13,118,Steven Soderbergh,"Channing Tatum, Adam Driver, Daniel Craig, Farrah Mackenzie","Action, Comedy, Crime",USA,29000000,48453605,"United States, China"552,Hostiles,7.2,2017,January,R,134,Scott Cooper,"Scott Shepherd, Rosamund Pike, Ava Cooper, Stella Cooper","Drama, Western",USA,39000000,35669017,United States553,Kingsman: The Golden Circle,6.7,2017,September,R,141,Matthew Vaughn,"Taron Egerton, Colin Firth, Mark Strong, Channing Tatum","Action, Adventure, Comedy",Italy,104000000,410902662,"United Kingdom, United States"554,Valerian and the City of a Thousand Planets,6.4,2017,July,PG-13,136,Luc Besson,"Dane DeHaan, Cara Delevingne, Clive Owen, Rihanna","Action, Adventure, Fantasy",France,177200000,225973340,"France, China, Belgium, Germany, United Arab Emirates, United States, Canada"555,American Made,7.1,2017,September,R,115,Doug Liman,"Tom Cruise, Domhnall Gleeson, Sarah Wright, Jesse Plemons","Action, Comedy, Crime",USA,50000000,134866593,"United States, Japan, Colombia"556,Fifty Shades Darker,4.6,2017,February,R,118,James Foley,"Dakota Johnson, Jamie Dornan, Eric Johnson, Eloise Mumford","Drama, Romance, Thriller",Canada,55000000,381545846,"United States, China, Japan"557,Suburbicon,5.8,2017,October,R,105,George Clooney,"Matt Damon, Julianne Moore, Oscar Isaac, Noah Jupe","Comedy, Crime, Drama",USA,25000000,12768857,"United Kingdom, United States, China"558,Christmas Inheritance,5.7,2017,December,Not Rated,104,Ernie Barbarash,"Eliza Taylor, Jake Lacy, Andie MacDowell, Neil Crone","Comedy, Drama, Romance",Canada,Unknown,Unknown,United States559,Ghost in the Shell,6.3,2017,March,PG-13,107,Rupert Sanders,"Scarlett Johansson, Pilou Asb k, Takeshi Kitano, Juliette Binoche","Action, Crime, Drama",New Zealand,110000000,169846945,"United States, India, Hong Kong, China, Canada"560,Paddington 2,7.8,2017,January,PG,103,Paul King,"Ben Whishaw, Hugh Grant, Hugh Bonneville, Sally Hawkins","Adventure, Comedy, Family",Ireland,40000000,227994792,"United Kingdom, France, United States, China, Canada"561,"I, Tonya",7.5,2017,January,R,119,Craig Gillespie,"Margot Robbie, Sebastian Stan, Allison Janney, Julianne Nicholson","Biography, Comedy, Drama",USA,11000000,53939297,"United States, United Kingdom"562,War for the Planet of the Apes,7.4,2017,July,PG-13,140,Matt Reeves,"Andy Serkis, Woody Harrelson, Steve Zahn, Karin Konoval","Action, Adventure, Drama",Canada,150000000,490719763,United States563,American Assassin,6.2,2017,September,R,111,Michael Cuesta,"Dylan O Brien, Michael Keaton, Sanaa Lathan, Taylor Kitsch","Action, Thriller",Italy,33000000,67234188,United States564,Disobedience,6.6,2017,April,R,114,Sebasti n Lelio,"Rachel Weisz, Rachel McAdams, Alessandro Nivola, Anton Lesser","Drama, Romance",UK,6000000,8003180,"Ireland, United Kingdom, United States"565,"Roman J. Israel, Esq.",6.5,2017,November,PG-13,122,Dan Gilroy,"Denzel Washington, Colin Farrell, Carmen Ejogo, Lynda Gravatt","Crime, Drama, Thriller",USA,22000000,13025860,"Canada, United Arab Emirates, United States"566,Gifted,7.6,2017,April,PG-13,101,Marc Webb,"Chris Evans, Mckenna Grace, Lindsay Duncan, Octavia Spencer",Drama,USA,7000000,43069254,United States567,Darkest Hour,7.4,2017,December,PG-13,125,Joe Wright,"Gary Oldman, Lily James, Kristin Scott Thomas, Ben Mendelsohn","Biography, Drama, War",UK,30000000,150847274,"United Kingdom, United States, China"568,Anna and the Apocalypse,6,2017,November,R,93,John McPhail,"Ella Hunt, Malcolm Cumming, Sarah Swire, Christopher Leveaux","Comedy, Horror, Musical",UK,Unknown,"$673,523",United Kingdom569,Good Time,7.3,2017,August,R,102,"Benny Safdie, Josh Safdie","Robert Pattinson, Benny Safdie, Jennifer Jason Leigh, Buddy Duress","Crime, Drama, Thriller",USA,4500000,3283369,United States570,The Ritual,6.3,2017,February,TV-MA,94,David Bruckner,"Rafe Spall, Arsher Ali, Robert James Collier, Sam Troughton","Horror, Mystery, Thriller",Romania,Unknown,"$1,785,977","United Kingdom, Canada"571,Kong: Skull Island,6.6,2017,March,PG-13,118,Jordan Vogt Roberts,"Tom Hiddleston, Samuel L Jackson, Brie Larson, John C Reilly","Action, Adventure, Fantasy",Vietnam,185000000,566652812,"United States, China"572,Papillon,7.2,2017,August,R,133,Michael Noer,"Charlie Hunnam, Damijan Oklopdzic, Christopher Fairbank, Jason Ryan","Adventure, Biography, Crime",Serbia,Unknown,"$10,060,903","United States, Czech Republic, Spain"573,The Big Sick,7.5,2017,July,R,120,Michael Showalter,"Kumail Nanjiani, Zoe Kazan, Holly Hunter, Ray Romano","Comedy, Drama, Romance",USA,5000000,56411585,United States574,Okja,7.3,2017,June,TV-MA,120,Bong Joon Ho,"Tilda Swinton, Paul Dano, Seo hyun Ahn, Jake Gyllenhaal","Action, Adventure, Drama",South Korea,50000000,2049823,"South Korea, United States"575,The Circle,5.3,2017,April,PG-13,110,James Ponsoldt,"Emma Watson, Tom Hanks, John Boyega, Ellar Coltrane","Drama, Sci-Fi, Thriller",USA,18000000,40656399,"United Arab Emirates, United States, France"576,The Fate of the Furious,6.6,2017,April,PG-13,136,F Gary Gray,"Vin Diesel, Jason Statham, Dwayne Johnson, Michelle Rodriguez","Action, Crime, Thriller",USA,250000000,1236005118,"United States, China, Japan"577,Shot Caller,7.3,2017,August,R,121,Ric Roman Waugh,"Nikolaj Coster Waldau, Omari Hardwick, Lake Bell, Jon Bernthal","Crime, Drama, Thriller",USA,Unknown,"$3,440,362",United States578,Picture of Beauty,3.4,2017,April,Not Rated,70,Maxim Ford,"Taylor Sands, Danielle Rose, Pawel Hajnos, Magdalena Bochan Jachimek","Drama, Romance",Poland,122998,Unknown,United Kingdom579,The Shack,6.2,2017,March,PG-13,132,Stuart Hazeldine,"Sam Worthington, Octavia Spencer, Tim McGraw, Radha Mitchell","Drama, Fantasy",Canada,20000000,96942115,"United States, Canada, Hong Kong"580,The Dark Tower,5.6,2017,August,PG-13,95,Nikolaj Arcel,"Idris Elba, Matthew McConaughey, Tom Taylor, Dennis Haysbert","Action, Adventure, Fantasy",South Africa,60000000,113231078,United States581,Pitch Perfect 3,5.8,2017,December,PG-13,93,Trish Sie,"Anna Kendrick, Rebel Wilson, Brittany Snow, Anna Camp","Comedy, Music",USA,45000000,185400345,"United States, China"582,First Reformed,7.1,2017,May,R,113,Paul Schrader,"Ethan Hawke, Amanda Seyfried, Cedric the Entertainer, Victoria Hill","Drama, Mystery, Thriller",USA,3500000,3862498,"United States, United Kingdom, Australia"583,Hot Summer Nights,6.3,2017,July,R,107,Elijah Bynum,"Timoth e Chalamet, Maika Monroe, Alex Roe, Emory Cohen","Crime, Drama, Romance",USA,Unknown,"$246,133",United States584,Only the Brave,7.6,2017,October,PG-13,134,Joseph Kosinski,"Josh Brolin, Miles Teller, Jeff Bridges, Jennifer Connelly","Action, Biography, Drama",USA,38000000,26351322,United States585,Finding Your Feet,6.7,2017,March,PG-13,111,Richard Loncraine,"Imelda Staunton, Celia Imrie, Timothy Spall, Joanna Lumley","Comedy, Drama, Family",UK,6641892,15775555,United Kingdom586,Before I Fall,6.4,2017,March,PG-13,98,Ry Russo Young,"Zoey Deutch, Halston Sage, Cynthy Wu, Medalion Rahimi","Drama, Fantasy, Mystery",Canada,5000000,16373843,United States587,1922,6.2,2017,October,TV-MA,102,Zak Hilditch,"Thomas Jane, Molly Parker, Dylan Schmid, Kaitlyn Bernard","Crime, Drama, Horror",Canada,Unknown,Unknown,"United States, Canada"588,The Disaster Artist,7.3,2017,December,R,104,James Franco,"James Franco, Dave Franco, Ari Graynor, Seth Rogen","Biography, Comedy, Drama",USA,10000000,29820616,United States589,Thoroughbreds,6.6,2017,March,R,92,Cory Finley,"Olivia Cooke, Anya Taylor Joy, Anton Yelchin, Paul Sparks","Comedy, Crime, Drama",USA,6000000,3187255,United States590,The Endless,6.5,2017,April,Not Rated,111,"Justin Benson, Aaron Moorhead","Aaron Moorhead, Justin Benson, Callie Hernandez, Tate Ellington","Drama, Fantasy, Horror",USA,Unknown,"$956,425",United States591,You Were Never Really Here,6.7,2017,April,R,89,Lynne Ramsay,"Joaquin Phoenix, Judith Roberts, Ekaterina Samsonov, John Doman","Crime, Drama",USA,Unknown,"$9,360,514","United Kingdom, France, United States"592,The Florida Project,7.6,2017,November,R,111,Sean Baker,"Brooklynn Prince, Bria Vinaite, Willem Dafoe, Christopher Rivera",Drama,USA,2000000,10954677,United States593,The Hitman's Bodyguard,6.9,2017,August,R,118,Patrick Hughes,"Ryan Reynolds, Samuel L Jackson, Gary Oldman, Elodie Yung","Action, Comedy, Crime",The Netherlands,30000000,183428689,"United States, Hong Kong, Bulgaria, Netherlands, Canada, United Kingdom, France"594,Geostorm,5.3,2017,October,PG-13,109,Dean Devlin,"Gerard Butler, Jim Sturgess, Abbie Cornish, Alexandra Maria Lara","Action, Sci-Fi, Thriller",United Arab Emirates,120000000,221600160,United States595,Happy Death Day,6.6,2017,October,PG-13,96,Christopher Landon,"Jessica Rothe, Israel Broussard, Ruby Modine, Charles Aitken","Comedy, Horror, Mystery",USA,4800000,125479266,United States596,Bright,6.3,2017,December,TV-MA,117,David Ayer,"Will Smith, Joel Edgerton, Noomi Rapace, Edgar Ram rez","Action, Fantasy, Thriller",USA,90000000,Unknown,United States597,Downsizing,5.8,2017,December,R,135,Alexander Payne,"Matt Damon, Christoph Waltz, Hong Chau, Kristen Wiig","Drama, Fantasy, Sci-Fi",Norway,68000000,55003890,"United States, Norway"598,Pottersville,5.4,2017,November,PG-13,84,Seth Henrikson,"Michael Shannon, Judy Greer, Ron Perlman, Christina Hendricks",Comedy,USA,Unknown,Unknown,United States599,Columbus,7.2,2017,August,Not Rated,100,Kogonada,"John Cho, Haley Lu Richardson, Parker Posey, Michelle Forbes",Drama,USA,Unknown,"$1,093,077",United States600,Office Christmas Party,5.9,2016,December,R,105,"Josh Gordon, Will Speck","Jason Bateman, Olivia Munn, T J Miller, Jennifer Aniston",Comedy,USA,45000000,114501299,"United States, India"601,Rogue One: A Star Wars Story,7.8,2016,December,PG-13,133,Gareth Edwards,"Felicity Jones, Diego Luna, Alan Tudyk, Donnie Yen","Action, Adventure, Sci-Fi",Iceland,200000000,1058682142,United States602,Zoolander 2,4.7,2016,February,PG-13,101,Ben Stiller,"Ben Stiller, Owen Wilson, Pen lope Cruz, Will Ferrell","Action, Adventure, Comedy",Italy,50000000,56722693,"United States, Italy"603,Split,7.3,2016,January,PG-13,117,M Night Shyamalan,"James McAvoy, Anya Taylor Joy, Haley Lu Richardson, Jessica Sula","Horror, Thriller",USA,9000000,278454417,"United States, Japan"604,The Handmaiden,8.1,2016,June,Not Rated,145,Park Chan wook,"Kim Min hee, Ha Jung woo, Cho Jin woong, Moon So ri","Drama, Romance, Thriller",Japan,7660105,37854655,South Korea605,Terrifier,5.6,2016,March,Not Rated,85,Damien Leone,"Jenna Kanell, Samantha Scaffidi, David Howard Thornton, Catherine Corcoran","Horror, Thriller",Unknown,35000,76376,United States606,Better Watch Out,6.5,2016,October,R,89,Chris Peckover,"Olivia DeJonge, Levi Miller, Ed Oxenbould, Aleks Mikic","Comedy, Horror, Thriller",Australia,Unknown,"$176,288","Australia, United States"607,Nocturnal Animals,7.5,2016,December,R,116,Tom Ford,"Amy Adams, Jake Gyllenhaal, Michael Shannon, Aaron Taylor Johnson","Drama, Thriller",USA,22500000,30311857,"United States, China"608,Storks,6.8,2016,September,PG,87,"Nicholas Stoller, Doug Sweetland","Andy Samberg, Katie Crown, Kelsey Grammer, Jennifer Aniston","Animation, Adventure, Comedy",Unknown,70000000,183510278,United States609,La La Land,8,2016,December,PG-13,128,Damien Chazelle,"Ryan Gosling, Emma Stone, Rosemarie DeWitt, J K Simmons","Comedy, Drama, Music",USA,30000000,471227161,"United States, Hong Kong"610,Suicide Squad,5.9,2016,August,PG-13,123,David Ayer,"Will Smith, Jared Leto, Margot Robbie, Viola Davis","Action, Adventure, Fantasy",Canada,175000000,746846894,United States611,Deadpool,8,2016,February,R,108,Tim Miller,"Ryan Reynolds, Morena Baccarin, T J Miller, Ed Skrein","Action, Adventure, Comedy",Canada,58000000,782836791,United States612,Hacksaw Ridge,8.1,2016,November,R,139,Mel Gibson,"Andrew Garfield, Sam Worthington, Luke Bracey, Teresa Palmer","Biography, Drama, History",Australia,40000000,180563636,"Australia, United States, United Kingdom, China"613,Arrival,7.9,2016,November,PG-13,116,Denis Villeneuve,"Amy Adams, Jeremy Renner, Forest Whitaker, Michael Stuhlbarg","Drama, Mystery, Sci-Fi",Canada,47000000,203388186,"United States, Canada"614,Me Before You,7.4,2016,June,PG-13,106,Thea Sharrock,"Emilia Clarke, Sam Claflin, Janet McTeer, Charles Dance","Drama, Romance",UK,20000000,208314186,"United Kingdom, United States"615,The Nice Guys,7.3,2016,May,R,116,Shane Black,"Russell Crowe, Ryan Gosling, Angourie Rice, Matt Bomer","Action, Comedy, Crime",USA,50000000,62788218,United States616,Sing,7.1,2016,December,PG,108,"Garth Jennings, Christophe Lourdelet","Matthew McConaughey, Reese Witherspoon, Seth MacFarlane, Scarlett Johansson","Animation, Comedy, Family",USA,75000000,634338384,"Japan, United States, France"617,Bad Moms,6.2,2016,July,R,100,"Jon Lucas, Scott Moore","Mila Kunis, Kathryn Hahn, Kristen Bell, Christina Applegate",Comedy,USA,20000000,183936074,"United States, China"618,Zootopia,8,2016,March,PG,108,"Byron Howard, Rich Moore, Jared Bush","Ginnifer Goodwin, Jason Bateman, Idris Elba, Jenny Slate","Animation, Adventure, Comedy",USA,150000000,1042533689,United States619,Hell or High Water,7.6,2016,August,R,102,David Mackenzie,"Chris Pine, Ben Foster, Jeff Bridges, Gil Birmingham","Crime, Drama, Thriller",USA,12000000,37999675,United States620,Sausage Party,6.1,2016,August,R,89,"Greg Tiernan, Conrad Vernon","Seth Rogen, Kristen Wiig, Jonah Hill, Alistair Abell","Animation, Adventure, Comedy",USA,19000000,140705322,"United States, Canada"621,Manchester by the Sea,7.8,2016,December,R,137,Kenneth Lonergan,"Casey Affleck, Michelle Williams, Kyle Chandler, Lucas Hedges",Drama,USA,9000000,78988148,United States622,Batman v Superman: Dawn of Justice,6.4,2016,March,PG-13,151,Zack Snyder,"Ben Affleck, Henry Cavill, Amy Adams, Jesse Eisenberg","Action, Adventure, Sci-Fi",USA,250000000,873637528,United States623,Bad Santa 2,5.6,2016,November,R,92,Mark Waters,"Billy Bob Thornton, Kathy Bates, Tony Cox, Christina Hendricks","Comedy, Crime, Drama",Canada,26000000,24079268,United States624,Train to Busan,7.6,2016,July,Not Rated,118,Sang ho Yeon,"Gong Yoo, Jung Yu mi, Ma Dong seok, Su an Kim","Action, Horror, Thriller",South Korea,7660105,92764199,South Korea625,13 Hours,7.3,2016,January,R,144,Michael Bay,"John Krasinski, Pablo Schreiber, James Badge Dale, David Denman","Action, Drama, History",Malta,50000000,69411370,"United States, Malta, Morocco"626,Moana,7.6,2016,November,PG,107,"Ron Clements, John Musker, Don Hall, Chris Williams","Auli i Cravalho, Dwayne Johnson, Rachel House, Temuera Morrison","Animation, Adventure, Comedy",Polynesia,150000000,665069139,United States627,Your Name.,8.4,2016,April,PG,106,Makoto Shinkai,"Ry nosuke Kamiki, Mone Kamishiraishi, Ry Narita, Aoi Y ki","Animation, Drama, Fantasy",Unknown,2789989,358180115,Japan628,The Magnificent Seven,6.8,2016,September,PG-13,132,Antoine Fuqua,"Denzel Washington, Chris Pratt, Ethan Hawke, Vincent D Onofrio","Action, Adventure, Western",USA,90000000,162360636,"United States, Australia"629,10 Cloverfield Lane,7.2,2016,March,PG-13,103,Dan Trachtenberg,"John Goodman, Mary Elizabeth Winstead, John Gallagher Jr , Douglas M Griffin","Drama, Horror, Mystery",USA,15000000,110216998,United States630,Miss Peregrine's Home for Peculiar Children,6.7,2016,September,PG-13,127,Tim Burton,"Eva Green, Asa Butterfield, Samuel L Jackson, Judi Dench","Adventure, Drama, Family",Belgium,110000000,296482446,"United States, United Kingdom, Belgium, Canada"631,Hidden Figures,7.8,2016,January,PG,127,Theodore Melfi,"Taraji P Henson, Octavia Spencer, Janelle Mon e, Kevin Costner","Biography, Drama, History",USA,25000000,235956898,United States632,The Edge of Seventeen,7.3,2016,November,R,104,Kelly Fremon Craig,"Hailee Steinfeld, Haley Lu Richardson, Blake Jenner, Kyra Sedgwick","Comedy, Drama",Canada,9000000,19370020,"United States, China"633,The Invisible Guest,8,2016,January,TV-MA,106,Oriol Paulo,"Mario Casas, Ana Wagener, Jose Coronado, B rbara Lennie","Crime, Drama, Mystery",Spain,4000000,31191910,Spain634,Doctor Strange,7.5,2016,November,PG-13,115,Scott Derrickson,"Benedict Cumberbatch, Chiwetel Ejiofor, Rachel McAdams, Benedict Wong","Action, Adventure, Fantasy",Nepal,165000000,677796076,United States635,Captain America: Civil War,7.8,2016,May,PG-13,147,"Anthony Russo, Joe Russo","Chris Evans, Robert Downey Jr , Scarlett Johansson, Sebastian Stan","Action, Adventure, Sci-Fi",Puerto Rico,250000000,1153337496,United States636,Passengers,7,2016,December,PG-13,116,Morten Tyldum,"Jennifer Lawrence, Chris Pratt, Michael Sheen, Laurence Fishburne","Drama, Romance, Sci-Fi",USA,110000000,303144152,"United States, Australia"637,Fences,7.2,2016,December,PG-13,139,Denzel Washington,"Denzel Washington, Viola Davis, Stephen McKinley Henderson, Jovan Adepo",Drama,USA,24000000,64414761,"United States, Canada"638,Moonlight,7.4,2016,November,R,111,Barry Jenkins,"Mahershala Ali, Naomie Harris, Trevante Rhodes, Alex R Hibbert",Drama,USA,4000000,65336603,United States639,Fantastic Beasts and Where to Find Them,7.2,2016,November,PG-13,132,David Yates,"Eddie Redmayne, Katherine Waterston, Alison Sudol, Dan Fogler","Adventure, Family, Fantasy",UK,180000000,814044001,"United Kingdom, United States"640,Warcraft,6.7,2016,June,PG-13,123,Duncan Jones,"Travis Fimmel, Paula Patton, Ben Foster, Dominic Cooper","Action, Adventure, Fantasy",Canada,160000000,439048914,"China, United States, Canada, Japan"641,The Girl on the Train,6.5,2016,October,R,112,Tate Taylor,"Emily Blunt, Haley Bennett, Rebecca Ferguson, Justin Theroux","Crime, Drama, Mystery",USA,45000000,173185859,"United States, India"642,X-Men: Apocalypse,6.9,2016,May,PG-13,144,Bryan Singer,"James McAvoy, Michael Fassbender, Jennifer Lawrence, Nicholas Hoult","Action, Adventure, Sci-Fi",Canada,178000000,543934105,United States643,Star Trek Beyond,7,2016,July,PG-13,122,Justin Lin,"Chris Pine, Zachary Quinto, Karl Urban, Zoe Saldana","Action, Adventure, Sci-Fi",United Arab Emirates,185000000,343471816,"United States, China"644,The Accountant,7.3,2016,October,R,128,Gavin O Connor,"Ben Affleck, Anna Kendrick, J K Simmons, Jon Bernthal","Action, Thriller",USA,44000000,155160045,United States645,Ghostbusters: Answer the Call,6.9,2016,July,PG-13,117,Paul Feig,"Melissa McCarthy, Kristen Wiig, Kate McKinnon, Leslie Jones","Action, Comedy, Fantasy",USA,144000000,229147509,"United States, Australia"646,Central Intelligence,6.3,2016,June,PG-13,107,Rawson Marshall Thurber,"Dwayne Johnson, Kevin Hart, Danielle Nicolet, Amy Ryan","Action, Comedy, Crime",USA,50000000,216972543,"United States, China"647,Don't Breathe,7.1,2016,August,R,88,Fede Alvarez,"Stephen Lang, Jane Levy, Dylan Minnette, Daniel Zovatto","Crime, Horror, Thriller",Hungary,9900000,157761002,"United States, Hungary"648,Below Her Mouth,5.5,2016,April,Not Rated,94,April Mullen,"Erika Linder, Natalie Krill, Sebastian Pigott, Mayko Nguyen","Drama, Romance",Canada,Unknown,"$33,673",Canada649,A Cure for Wellness,6.4,2016,February,R,146,Gore Verbinski,"Dane DeHaan, Jason Isaacs, Mia Goth, Ivo Nandi","Drama, Fantasy, Horror",Germany,40000000,26620002,"Germany, Luxembourg, United States"650,Captain Fantastic,7.8,2016,July,R,118,Matt Ross,"Viggo Mortensen, George MacKay, Samantha Isler, Annalise Basso","Comedy, Drama",USA,5000000,23123592,United States651,Swiss Army Man,6.9,2016,July,R,97,"Dan Kwan, Daniel Scheinert","Paul Dano, Daniel Radcliffe, Mary Elizabeth Winstead, Antonia Ribero","Comedy, Drama, Fantasy",USA,3000000,4935501,United States652,Everybody Wants Some!!,6.9,2016,April,R,117,Richard Linklater,"Blake Jenner, Tyler Hoechlin, Ryan Guzman, Zoey Deutch",Comedy,USA,10000000,4644472,United States653,The Bad Batch,5.2,2016,June,R,118,Ana Lily Amirpour,"Suki Waterhouse, Jason Momoa, Jayda Fink, Keanu Reeves","Action, Horror, Mystery",USA,6000000,201890,United States654,Independence Day: Resurgence,5.2,2016,June,PG-13,120,Roland Emmerich,"Liam Hemsworth, Jeff Goldblum, Bill Pullman, Maika Monroe","Action, Adventure, Sci-Fi",USA,165000000,389681935,United States655,The Legend of Tarzan,6.2,2016,July,PG-13,110,David Yates,"Alexander Skarsg rd, Rory J Saper, Christian Stevens, Christoph Waltz","Action, Adventure, Drama",Gabon,180000000,356700357,"United Kingdom, Canada, United States, Australia"656,War Dogs,7.1,2016,August,R,114,Todd Phillips,"Jonah Hill, Miles Teller, Steve Lantz, Gregg Weiner","Biography, Comedy, Crime",Romania,40000000,86234523,"United States, Romania"657,Dirty Grandpa,5.9,2016,January,R,102,Dan Mazer,"Robert De Niro, Zac Efron, Zoey Deutch, Aubrey Plaza",Comedy,USA,25000000,94073028,"United States, United Kingdom"658,Love Machine,4,2016,December,Not Rated,79,Pavel Ruminov,"Natalya Anisimova, Pavel Ruminov, Maria Lavrova, Rafael Durnonyan","Drama, Romance",Unknown,Unknown,Unknown,Russia659,The Conjuring 2,7.3,2016,June,R,134,James Wan,"Vera Farmiga, Patrick Wilson, Madison Wolfe, Frances O Connor","Horror, Mystery, Thriller",UK,40000000,321834351,"Canada, United States, United Kingdom"660,Jason Bourne,6.6,2016,July,PG-13,123,Paul Greengrass,"Matt Damon, Tommy Lee Jones, Alicia Vikander, Vincent Cassel","Action, Thriller",Spain,120000000,415484914,"United States, China, Spain, Japan, Germany"661,Why Him?,6.2,2016,December,R,111,John Hamburg,"Zoey Deutch, James Franco, Tangie Ambrose, Cedric the Entertainer",Comedy,USA,38000000,118102725,United States662,Almost Christmas,6.1,2016,November,PG-13,111,David E Talbert,"Kimberly Elise, Omar Epps, Danny Glover, Mo Nique","Comedy, Drama, Romance",USA,17000000,42580920,"United States, China"663,The Void,5.9,2016,April,Not Rated,90,"Jeremy Gillespie, Steven Kostanski","Aaron Poole, Kenneth Welsh, Ellen Wong, Kathleen Munroe","Horror, Mystery, Sci-Fi",Canada,Unknown,"$368,372",Canada664,Raw,7,2016,March,R,99,Julia Ducournau,"Garance Marillier, Ella Rumpf, Rabah Nait Oufella, Laurent Lucas","Drama, Horror",Belgium,3500000,3096815,"France, Belgium, United States"665,The 5th Wave,5.2,2016,January,PG-13,112,J Blakeson,"Chlo Grace Moretz, Matthew Zuk, Gabriela Lopez, Bailey Anne Borders","Action, Adventure, Sci-Fi",USA,38000000,109906372,"United States, United Kingdom"666,Now You See Me 2,6.4,2016,June,PG-13,129,Jon M Chu,"Jesse Eisenberg, Mark Ruffalo, Woody Harrelson, Dave Franco","Action, Adventure, Comedy",China,90000000,334897606,"United States, France, Hong Kong"667,The Neon Demon,6.1,2016,June,R,117,Nicolas Winding Refn,"Elle Fanning, Christina Hendricks, Keanu Reeves, Karl Glusman","Horror, Thriller",USA,7000000,3073700,"United States, Belgium, Denmark, France"668,Lion,8,2016,January,PG-13,118,Garth Davis,"Dev Patel, Nicole Kidman, Rooney Mara, Sunny Pawar","Biography, Drama",India,12000000,140853810,"Australia, United Kingdom, United States, India"669,Silence,7.1,2016,January,R,161,Martin Scorsese,"Andrew Garfield, Adam Driver, Liam Neeson, Tadanobu Asano","Drama, History",Taiwan,46000000,23834809,"United States, United Kingdom, Taiwan, Japan, Mexico"670,Gods of Egypt,5.4,2016,February,PG-13,127,Alex Proyas,"Brenton Thwaites, Nikolaj Coster Waldau, Gerard Butler, Chadwick Boseman","Action, Adventure, Fantasy",Australia,140000000,150680864,"United States, Australia, China, Hong Kong"671,Allied,7.1,2016,November,R,124,Robert Zemeckis,"Brad Pitt, Marion Cotillard, Jared Harris, Vincent Ebrahim","Action, Drama, Romance",Spain,85000000,119520023,"United Kingdom, United States"